{
  "request": {
    "request_id": "req-expired01",
    "source": "codex_upstream_watcher",
    "fingerprint": "fp-0.113.1",
    "chat_id": "262872984",
    "question_message_id": 77,
    "created_at": "2026-03-10T00:00:00Z",
    "expires_at": "2026-03-10T01:00:00Z",
    "status": "pending",
    "action_token": "tok-expired",
    "question_text": "Хотите получить практические рекомендации?",
    "delivery_mode": "inline_callback"
  },
  "recommendations": {
    "summary": "Нужно обновить проектные инструкции.",
    "items": []
  },
  "decision": null,
  "delivery": {
    "status": "not_sent"
  },
  "audit_notes": [
    "expired fixture"
  ]
}
